{
  "name": "Konfrut Tarım",
  "slug": "konfrut-tarim",
  "website": "https://www.konfrut.com.tr",
  "source": "https://www.kap.org.tr/tr/api/file/download/4028328d9cc9d32b019cd8749d2155c8",
  "hex": "024546",
  "aliases": [
    "KONFRUT TARIM A.Ş."
  ],
  "tickers": [
    {
      "exchange": "BIST",
      "symbol": "KNFRT"
    }
  ],
  "variants": [
    "default"
  ],
  "updated": "2026-10-19"
}
