{
  "name": "Şa-ra Enerji İnşaat",
  "slug": "sa-ra-enerji-insaat",
  "website": "https://sara-enerji.com",
  "source": "https://www.kap.org.tr/tr/api/file/download/4028328d9f52dddd019fd28a078e092b",
  "aliases": [
    "ŞA-RA ENERJİ İNŞAAT TİCARET VE SANAYİ A.Ş."
  ],
  "tickers": [
    {
      "exchange": "BIST",
      "symbol": "SARAE"
    }
  ],
  "variants": [
    "default"
  ],
  "updated": "2026-10-19",
  "hex": "12388D"
}
